{
  "schema_version": "1.0",
  "processed_submission_id": "processed_assessment_1_student_7",
  "source_submission_id": "assessment_1_student_7",
  "student_id": "student_7",
  "assessment_id": "assessment_1",
  "processing_version": "0.1.0",
  "artifacts": [
    {
      "artifact_id": "artifact_001",
      "artifact_type": "lean_source",
      "processing": {
        "status": "success",
        "extraction_mode": "textual",
        "detected_content_type": "lean_4_source",
        "tools": [
          {
            "name": "assessment-feedback-preprocessor",
            "version": "0.2.0",
            "purpose": "Structural textual extraction of Lean declarations, context, comments, and proof bodies."
          }
        ],
        "checks": [
          {
            "check_type": "lean_textual_extraction",
            "status": "passed",
            "tool": "assessment-feedback-preprocessor",
            "summary": "Extracted 15 Lean declaration(s)."
          },
          {
            "check_type": "lean_compile",
            "status": "not_run",
            "tool": null,
            "summary": "Lean compilation is not included in this preprocessing version."
          }
        ],
        "diagnostics": []
      },
      "units": [
        {
          "unit_id": "artifact_001_unit_001",
          "unit_type": "lean_opaque_declaration",
          "label": "provable",
          "source_range": {
            "start_line": 35,
            "end_line": 35
          },
          "content_blocks": [
            {
              "block_id": "artifact_001_unit_001_statement",
              "block_type": "formal_statement",
              "content": "opaque provable : Prop → Prop",
              "language": "lean",
              "source_range": {
                "start_line": 35,
                "end_line": 35
              }
            }
          ],
          "structured_data": {
            "declaration_type": "opaque",
            "contains_sorry": false,
            "scope_path": [],
            "context_declarations": [],
            "proof_style": "none"
          },
          "extraction_confidence": 0.9
        },
        {
          "unit_id": "artifact_001_unit_002",
          "unit_type": "lean_example",
          "label": "example_1",
          "source_range": {
            "start_line": 53,
            "end_line": 73
          },
          "content_blocks": [
            {
              "block_id": "artifact_001_unit_002_statement",
              "block_type": "formal_statement",
              "content": "example : provable z",
              "language": "lean",
              "source_range": {
                "start_line": 53,
                "end_line": 53
              }
            },
            {
              "block_id": "artifact_001_unit_002_proof",
              "block_type": "proof_body",
              "content": "--consider all four cases\n    Or.elim prerequisites\n        (\n         --x1 True\n         fun case1 =>\n            Or.elim approvals\n               --y1 True\n               (fun case1_1 => approval_1 h1)\n               --y2 True\n               (fun case1_2 => approval_2 h2)\n        )\n        (\n         --x2 True\n         fun case2 =>\n            Or.elim approvals\n               --y1 True\n               (fun case2_1 => approval_1 h1)\n               --y2 True\n               (fun case2_2 => approval_2 h2)\n        )",
              "language": "lean",
              "source_range": {
                "start_line": 54,
                "end_line": 73
              }
            }
          ],
          "structured_data": {
            "declaration_type": "example",
            "contains_sorry": false,
            "scope_path": [],
            "context_declarations": [
              {
                "context_id": "context_001",
                "declaration_type": "variable",
                "content": "variable (x1 x2 y1 y2 z : Prop)",
                "source_range": {
                  "start_line": 37,
                  "end_line": 37
                }
              },
              {
                "context_id": "context_002",
                "declaration_type": "variable",
                "content": "variable (prerequisites : (x1 ∨ x2))",
                "source_range": {
                  "start_line": 40,
                  "end_line": 40
                }
              },
              {
                "context_id": "context_003",
                "declaration_type": "variable",
                "content": "variable (approvals : (y1 ∨ y2))",
                "source_range": {
                  "start_line": 41,
                  "end_line": 41
                }
              },
              {
                "context_id": "context_004",
                "declaration_type": "variable",
                "content": "variable (prerequisite_1 : provable x1 -> provable z)",
                "source_range": {
                  "start_line": 44,
                  "end_line": 44
                }
              },
              {
                "context_id": "context_005",
                "declaration_type": "variable",
                "content": "variable (prerequisite_2 : provable x2 -> provable z)",
                "source_range": {
                  "start_line": 45,
                  "end_line": 45
                }
              },
              {
                "context_id": "context_006",
                "declaration_type": "variable",
                "content": "variable (approval_1 : provable y1 -> provable z)",
                "source_range": {
                  "start_line": 46,
                  "end_line": 46
                }
              },
              {
                "context_id": "context_007",
                "declaration_type": "variable",
                "content": "variable (approval_2 : provable y2 -> provable z)",
                "source_range": {
                  "start_line": 47,
                  "end_line": 47
                }
              },
              {
                "context_id": "context_008",
                "declaration_type": "variable",
                "content": "variable (h1 : provable y1)",
                "source_range": {
                  "start_line": 50,
                  "end_line": 50
                }
              },
              {
                "context_id": "context_009",
                "declaration_type": "variable",
                "content": "variable (h2 : provable y2)",
                "source_range": {
                  "start_line": 51,
                  "end_line": 51
                }
              }
            ],
            "proof_style": "term"
          },
          "extraction_confidence": 0.9
        },
        {
          "unit_id": "artifact_001_unit_003",
          "unit_type": "lean_example",
          "label": "example_2",
          "source_range": {
            "start_line": 123,
            "end_line": 146
          },
          "content_blocks": [
            {
              "block_id": "artifact_001_unit_003_statement",
              "block_type": "formal_statement",
              "content": "example (BiometricIdentificationRequiredAsSpendingPatternExceeded : b -> d)\n        (ResponseToTransactionFromUnregisteredDevice : ¬a -> (c ∧ d))\n        (PrimarySecurityConditionSatisifed : (a ∨ d))\n        (SpendingPatternExceeded : b)\n        (InconsistentLocationHistory : ¬c) :\n        (a ∧ d)",
              "language": "lean",
              "source_range": {
                "start_line": 123,
                "end_line": 128
              }
            },
            {
              "block_id": "artifact_001_unit_003_proof",
              "block_type": "proof_body",
              "content": "--b, b → d gives d i.e. modes ponens\n         have pfd : d := BiometricIdentificationRequiredAsSpendingPatternExceeded SpendingPatternExceeded\n         --as both a and d are True this satisfies the condition (a ∨ d)\n         have pfaord : a ∨ d := Or.intro_right a pfd\n         --assume a is False, therefore from ¬a → (c ∧ d) both c and d must be True. However, it is given that ¬c is True.\n         --Both c and ¬c cannot be True. This is a contradiction. Therefore the original assumption that a is False must be wrong.\n         --a must therefore also be True.\n         have pfa : a :=\n              byContradiction\n              (fun pfnota : ¬a =>\n                   --modes ponens\n                   have pfcd: c ∧ d := ResponseToTransactionFromUnregisteredDevice pfnota\n                   --and elimination to give c\n                   have pfc : c := And.left pfcd\n                   --have contradiction, i.e., c and ¬c\n                   show False from absurd pfc InconsistentLocationHistory)\n         have pfconj : (a ∧ d) := And.intro pfa pfd\n         show (a ∧ d) from pfconj",
              "language": "lean",
              "source_range": {
                "start_line": 129,
                "end_line": 146
              }
            }
          ],
          "structured_data": {
            "declaration_type": "example",
            "contains_sorry": false,
            "scope_path": [],
            "context_declarations": [
              {
                "context_id": "context_001",
                "declaration_type": "variable",
                "content": "variable (x1 x2 y1 y2 z : Prop)",
                "source_range": {
                  "start_line": 37,
                  "end_line": 37
                }
              },
              {
                "context_id": "context_002",
                "declaration_type": "variable",
                "content": "variable (prerequisites : (x1 ∨ x2))",
                "source_range": {
                  "start_line": 40,
                  "end_line": 40
                }
              },
              {
                "context_id": "context_003",
                "declaration_type": "variable",